{
  "createdAt": "2026-10-27T19:38:24+08:00",
  "domain": "project",
  "file": {
    "mediaType": "text/markdown",
    "path": "primary.md",
    "sha256": "020cdae6cb8eb602d41453ddc5b15161c0d9c6a0cda7c181d5d37cd2df973a15",
    "sizeBytes": 43242
  },
  "history": [
    {
      "action": "imported",
      "actor": "项目开发负责人",
      "at": "2026-10-27T19:38:24+08:00",
      "fromStatus": null,
      "note": "从根目录开发计划复制入库；原文件保持不变",
      "toStatus": "review"
    },
    {
      "action": "revised",
      "actor": "Codex",
      "at": "2026-10-28T20:20:03+08:00",
      "fromStatus": "review",
      "note": "同步 Unity 6000.0.30f1 实现、9 个 PlayMode 测试、真实三端联调与 Windows Player 构建结果",
      "toStatus": "draft"
    },
    {
      "action": "revised",
      "actor": "Codex",
      "at": "2026-10-28T20:23:53+08:00",
      "fromStatus": "draft",
      "note": "补充 10 个 PlayMode 测试、离屏 UI 预览、脚本化验证和最终构建结果",
      "toStatus": "draft"
    }
  ],
  "id": "DOC-20261027-001",
  "owner": "项目开发负责人",
  "primaryFile": "primary.md",
  "provenance": {
    "generator": "Codex",
    "humanReview": "pending",
    "modelVersion": "GPT-5",
    "origin": "ai",
    "promptRef": "P-009",
    "reviewNotes": "",
    "sourceRefs": []
  },
  "related": [],
  "revision": 3,
  "schemaVersion": 1,
  "status": "draft",
  "summary": "Unity、Go、React 三端巡检闭环的实施方案、数据契约、实施阶段与验收标准",
  "supersededBy": null,
  "supersedes": null,
  "tags": [
    "unity-3d",
    "inspection",
    "plan",
    "project"
  ],
  "title": "Unity 3D 虚拟现场巡检系统开发计划",
  "type": "plan",
  "updatedAt": "2026-10-28T20:23:53+08:00",
  "version": "0.2",
  "versions": [
    {
      "actor": "Codex",
      "at": "2026-10-28T20:20:03+08:00",
      "file": {
        "mediaType": "text/markdown",
        "path": "versions/v001_primary.md",
        "sha256": "9e248c8740d434971be5c03abcbb09dbd8e8c37de05294b09f2580d9a0611f73",
        "sizeBytes": 40999
      },
      "note": "同步 Unity 6000.0.30f1 实现、9 个 PlayMode 测试、真实三端联调与 Windows Player 构建结果",
      "path": "versions/v001_primary.md",
      "revision": 1
    },
    {
      "actor": "Codex",
      "at": "2026-10-28T20:23:53+08:00",
      "file": {
        "mediaType": "text/markdown",
        "path": "versions/v002_primary.md",
        "sha256": "b6ba777793317197c9a4211554fea4f25b24ebaf4a207cfba507c81c06858d12",
        "sizeBytes": 43240
      },
      "note": "补充 10 个 PlayMode 测试、离屏 UI 预览、脚本化验证和最终构建结果",
      "path": "versions/v002_primary.md",
      "revision": 2
    }
  ]
}
